title,price,link,site
2021 принт вязаное облегающее платье женское зеленое Y2K летнее Открытое сексуальное платье без рукавов на бретельках пляжное платье миди пла...,"434,18 - 1 184,91 руб.","//aliexpress.ru/item/1005002332297804.html?algo_pvid=bda2d55a-7162-413f-9978-515914c08c66&algo_expid=bda2d55a-7162-413f-9978-515914c08c66-1&btsid=0b8b15ea16190717202897993efe8c&ws_ab_test=searchweb0_0,searchweb201602_,searchweb201603_",aliexpress
"Комплект летней одежды для новорожденных девочек 2021, хлопковое боди, платье, пальто с длинным рукавом + платье с коротким рукавом, комплект и...","725,47 руб.","//aliexpress.ru/item/33000425276.html?algo_pvid=bda2d55a-7162-413f-9978-515914c08c66&algo_expid=bda2d55a-7162-413f-9978-515914c08c66-2&btsid=0b8b15ea16190717202897993efe8c&ws_ab_test=searchweb0_0,searchweb201602_,searchweb201603_",aliexpress
"Пикантное женское длинное платье на шнуровке, лоскутное платье без рукавов, плиссированное, с открытой спиной, с вырезами, женские платья с ...","799,68 руб.","//aliexpress.ru/item/1005002383167080.html?algo_pvid=bda2d55a-7162-413f-9978-515914c08c66&algo_expid=bda2d55a-7162-413f-9978-515914c08c66-3&btsid=0b8b15ea16190717202897993efe8c&ws_ab_test=searchweb0_0,searchweb201602_,searchweb201603_",aliexpress
"Твердые Цвет элегантные женские вечерние платье 2021 летнее сексуальное платье без рукавов с v-образным вырезом, с карманами, женская повседн...","688,37 руб.","//aliexpress.ru/item/1005002478331862.html?s=p&ad_pvid=202104212308404004488066956580018009462_73&algo_pvid=bda2d55a-7162-413f-9978-515914c08c66&algo_expid=bda2d55a-7162-413f-9978-515914c08c66-4&btsid=0b8b15ea16190717202897993efe8c&ws_ab_test=searchweb0_0,searchweb201602_,searchweb201603_",aliexpress
"Платье для девочки на один год, для дня рождения, для крещения","474,44 руб.","//aliexpress.ru/item/32973988946.html?algo_pvid=bda2d55a-7162-413f-9978-515914c08c66&algo_expid=bda2d55a-7162-413f-9978-515914c08c66-5&btsid=0b8b15ea16190717202897993efe8c&ws_ab_test=searchweb0_0,searchweb201602_,searchweb201603_",aliexpress
"Платья для девочек, Новинка лета 2020, детское джинсовое платье с цветочным рисунком и рукавами-фонариками, хлопковое кружевное детское плать...","170,51 руб.","//aliexpress.ru/item/4000921167981.html?algo_pvid=bda2d55a-7162-413f-9978-515914c08c66&algo_expid=bda2d55a-7162-413f-9978-515914c08c66-6&btsid=0b8b15ea16190717202897993efe8c&ws_ab_test=searchweb0_0,searchweb201602_,searchweb201603_",aliexpress
"Платье Pudcoco для девочек, стандартное платье в английском стиле для новорожденных девочек, платье принцессы с бантом, праздничная повседневн...","322,08 - 344,18 руб.","//aliexpress.ru/item/32976828757.html?algo_pvid=bda2d55a-7162-413f-9978-515914c08c66&algo_expid=bda2d55a-7162-413f-9978-515914c08c66-7&btsid=0b8b15ea16190717202897993efe8c&ws_ab_test=searchweb0_0,searchweb201602_,searchweb201603_",aliexpress
MUABABY Волшебные волосы принцесса одеваются костюмы дети мультфильм ролевой косплей платья девушки карнавал Хэллоуин одежда подарок на день ...,"1 159,65 руб.","//aliexpress.ru/item/1005001507436000.html?algo_pvid=528a55fb-70a0-4e22-9188-d8f21d9dee70&algo_expid=528a55fb-70a0-4e22-9188-d8f21d9dee70-0&btsid=0b8b15ea16190717260438037efe8c&ws_ab_test=searchweb0_0,searchweb201602_,searchweb201603_",aliexpress
Детское платье для маленьких девочек Милая повседневная одежда с длинными рукавами с круглым вырезом с однотонным гофрированным трапециев...,"280,24 - 295,24 руб.","//aliexpress.ru/item/1005001780620282.html?algo_pvid=528a55fb-70a0-4e22-9188-d8f21d9dee70&algo_expid=528a55fb-70a0-4e22-9188-d8f21d9dee70-1&btsid=0b8b15ea16190717260438037efe8c&ws_ab_test=searchweb0_0,searchweb201602_,searchweb201603_",aliexpress
"Белое платье для подружки невесты TiaoBug, пиротехника, вечерние бальные платья, детские платья с цветами и бантом для святой причастия, платья ...","986,77 - 1 233,86 руб.","//aliexpress.ru/item/32776179266.html?algo_pvid=528a55fb-70a0-4e22-9188-d8f21d9dee70&algo_expid=528a55fb-70a0-4e22-9188-d8f21d9dee70-2&btsid=0b8b15ea16190717260438037efe8c&ws_ab_test=searchweb0_0,searchweb201602_,searchweb201603_",aliexpress
"Детское платье-пачка из тюля, с бантом и кольцами на ногу","551,01 руб.","//aliexpress.ru/item/4000162038736.html?algo_pvid=528a55fb-70a0-4e22-9188-d8f21d9dee70&algo_expid=528a55fb-70a0-4e22-9188-d8f21d9dee70-3&btsid=0b8b15ea16190717260438037efe8c&ws_ab_test=searchweb0_0,searchweb201602_,searchweb201603_",aliexpress
"Женское винтажное платье с цветочным принтом, Элегантное повседневное свободное платье до колена с V-образным вырезом и рукавом до локтя, ле...","1 024,66 руб.","//aliexpress.ru/item/1005002431275671.html?s=p&ad_pvid=20210421230846981586656165500000905573_85&algo_pvid=528a55fb-70a0-4e22-9188-d8f21d9dee70&algo_expid=528a55fb-70a0-4e22-9188-d8f21d9dee70-4&btsid=0b8b15ea16190717260438037efe8c&ws_ab_test=searchweb0_0,searchweb201602_,searchweb201603_",aliexpress
"Одежда для новорожденных Одежда для маленьких девочек хлопок, для детей ясельного возраста, комбинезон Повседневная одежда из хлопка без р...","219,46 - 230,51 руб.","//aliexpress.ru/item/4000414829499.html?algo_pvid=528a55fb-70a0-4e22-9188-d8f21d9dee70&algo_expid=528a55fb-70a0-4e22-9188-d8f21d9dee70-5&btsid=0b8b15ea16190717260438037efe8c&ws_ab_test=searchweb0_0,searchweb201602_,searchweb201603_",aliexpress
"Маленькая принцесса с цветочным рисунком Единорог платье для маленьких девочек; Зимнее Платье для первого дня рождения, многоярусная юбка ...","666,27 руб.","//aliexpress.ru/item/33016746350.html?algo_pvid=528a55fb-70a0-4e22-9188-d8f21d9dee70&algo_expid=528a55fb-70a0-4e22-9188-d8f21d9dee70-6&btsid=0b8b15ea16190717260438037efe8c&ws_ab_test=searchweb0_0,searchweb201602_,searchweb201603_",aliexpress
"Повседневное кружевное однотонное платье для маленьких девочек, цельное платье с короткими рукавами-мушками и квадратным вырезом, мандари...","278,66 - 307,87 руб.","//aliexpress.ru/item/1005002094524278.html?algo_pvid=528a55fb-70a0-4e22-9188-d8f21d9dee70&algo_expid=528a55fb-70a0-4e22-9188-d8f21d9dee70-7&btsid=0b8b15ea16190717260438037efe8c&ws_ab_test=searchweb0_0,searchweb201602_,searchweb201603_",aliexpress
"Сексуальное женское вечернее платье Adogirl, элегантное облегающее однотонное мини-платье с открытой спиной, вечерние Клубные наряды, платья с...","937,04 руб.","//aliexpress.ru/item/1005002327154507.html?algo_pvid=afb2af79-0977-4fff-acd9-d00a57b351fc&algo_expid=afb2af79-0977-4fff-acd9-d00a57b351fc-0&btsid=0b8b15ea16190717298368053efe8c&ws_ab_test=searchweb0_0,searchweb201602_,searchweb201603_",aliexpress
ZUOMAN женское летнее Длинное Элегантное платье с цветочным рисунком праздничное платье высокого качества на бретелях вечерние роковой Винта...,"2 069,85 руб.","//aliexpress.ru/item/1005002406440597.html?algo_pvid=afb2af79-0977-4fff-acd9-d00a57b351fc&algo_expid=afb2af79-0977-4fff-acd9-d00a57b351fc-1&btsid=0b8b15ea16190717298368053efe8c&ws_ab_test=searchweb0_0,searchweb201602_,searchweb201603_",aliexpress
"Размера плюс V образным вырезом Русалка коктейльное платье, длинное торжественное платье для выпускного вечера вечерние платье для балла с ...","3 021,09 руб.","//aliexpress.ru/item/4000112994932.html?algo_pvid=afb2af79-0977-4fff-acd9-d00a57b351fc&algo_expid=afb2af79-0977-4fff-acd9-d00a57b351fc-2&btsid=0b8b15ea16190717298368053efe8c&ws_ab_test=searchweb0_0,searchweb201602_,searchweb201603_",aliexpress
"Детское милое платье без рукавов, Радужное платье принцессы с бантом, наряды, летнее пляжное платье, костюм, платья","212,35 - 356,82 руб.","//aliexpress.ru/item/1005002401919239.html?algo_pvid=afb2af79-0977-4fff-acd9-d00a57b351fc&algo_expid=afb2af79-0977-4fff-acd9-d00a57b351fc-3&btsid=0b8b15ea16190717298368053efe8c&ws_ab_test=searchweb0_0,searchweb201602_,searchweb201603_",aliexpress
"Celandine, летнее пляжное Повседневное платье с градиентными ремешками, бохо, женское длинное облегающее сексуальное платье с открытыми плечам...","1 160,44 руб.","//aliexpress.ru/item/1005002509875296.html?s=p&ad_pvid=2021042123084918389131701306780000905088_97&algo_pvid=afb2af79-0977-4fff-acd9-d00a57b351fc&algo_expid=afb2af79-0977-4fff-acd9-d00a57b351fc-4&btsid=0b8b15ea16190717298368053efe8c&ws_ab_test=searchweb0_0,searchweb201602_,searchweb201603_",aliexpress
"Женственная Дамская обувь Спагетти ремень длиной до колена платье миди Женская Праздничная обувь топы с открытой спиной, из кусков, платья ...","907,04 - 991,51 руб.","//aliexpress.ru/item/1005002475099641.html?algo_pvid=afb2af79-0977-4fff-acd9-d00a57b351fc&algo_expid=afb2af79-0977-4fff-acd9-d00a57b351fc-5&btsid=0b8b15ea16190717298368053efe8c&ws_ab_test=searchweb0_0,searchweb201602_,searchweb201603_",aliexpress
"Женское трикотажное мини-платье Y2K, летнее пляжное облегающее платье с лямкой на шее, открытой спиной и белым принтом без рукавов, 2021","1 048,34 - 1 149,39 руб.","//aliexpress.ru/item/1005002369691000.html?algo_pvid=afb2af79-0977-4fff-acd9-d00a57b351fc&algo_expid=afb2af79-0977-4fff-acd9-d00a57b351fc-6&btsid=0b8b15ea16190717298368053efe8c&ws_ab_test=searchweb0_0,searchweb201602_,searchweb201603_",aliexpress
Новое платье для маленьких девочек милое детское платье с героями мультфильмов одежда для малышей милое платье для девочек платья для ново...,"303,92 руб.","//aliexpress.ru/item/32999240666.html?algo_pvid=afb2af79-0977-4fff-acd9-d00a57b351fc&algo_expid=afb2af79-0977-4fff-acd9-d00a57b351fc-7&btsid=0b8b15ea16190717298368053efe8c&ws_ab_test=searchweb0_0,searchweb201602_,searchweb201603_",aliexpress
