title,price,link,site
"Женское винтажное платье с цветочным принтом Syiwidii, Повседневное платье средней длины с длинным рукавом, весна-лето 2021, элегантные черные пл...","1 025,45 - 1 143,86 руб.","//aliexpress.ru/item/1005001606216457.html?algo_pvid=8b6ef634-7533-4a22-bd7f-f9b9a028bde0&algo_expid=8b6ef634-7533-4a22-bd7f-f9b9a028bde0-0&btsid=0b8b15ea16190717046877920efe8c&ws_ab_test=searchweb0_0,searchweb201602_,searchweb201603_",aliexpress
"Syiwidii женское длинное платье-рубашка из хлопка, Корейская одежда, белое пляжное платье в стиле бохо, большие синие платья макси, весна-лето 2021...","1 522,78 руб.","//aliexpress.ru/item/1005001669241446.html?algo_pvid=8b6ef634-7533-4a22-bd7f-f9b9a028bde0&algo_expid=8b6ef634-7533-4a22-bd7f-f9b9a028bde0-1&btsid=0b8b15ea16190717046877920efe8c&ws_ab_test=searchweb0_0,searchweb201602_,searchweb201603_",aliexpress
"Syiwidii женское атласное платье без рукавов на тонких бретелях, прямой однотонный роскошный блестящий сарафан, сексуальное платье из искусств...","1 050,71 руб.","//aliexpress.ru/item/1005001914425066.html?algo_pvid=8b6ef634-7533-4a22-bd7f-f9b9a028bde0&algo_expid=8b6ef634-7533-4a22-bd7f-f9b9a028bde0-2&btsid=0b8b15ea16190717046877920efe8c&ws_ab_test=searchweb0_0,searchweb201602_,searchweb201603_",aliexpress
"Женское платье с цветочным принтом Syiwidii, кружевное платье размера плюс с длинным рукавом на весну и осень, вечерние платья средней длины для...","1 159,65 - 1 314,38 руб.","//aliexpress.ru/item/1005001797199715.html?algo_pvid=8b6ef634-7533-4a22-bd7f-f9b9a028bde0&algo_expid=8b6ef634-7533-4a22-bd7f-f9b9a028bde0-3&btsid=0b8b15ea16190717046877920efe8c&ws_ab_test=searchweb0_0,searchweb201602_,searchweb201603_",aliexpress
Syiwidii атласное платье для женщин без рукавов Спагетти ремень повседневные Прямые красные черные весна лето 2021 Модные Вечерние Платья во фра...,"1 578,04 руб.","//aliexpress.ru/item/1005001931094470.html?algo_pvid=8b6ef634-7533-4a22-bd7f-f9b9a028bde0&algo_expid=8b6ef634-7533-4a22-bd7f-f9b9a028bde0-4&btsid=0b8b15ea16190717046877920efe8c&ws_ab_test=searchweb0_0,searchweb201602_,searchweb201603_",aliexpress
Syiwidii водолазка женская элегантное OL платье-свитер с высоким воротником женское тонкое длинное плотное вязаное платье на осень и зиму женск...,"1 700,40 руб.","//aliexpress.ru/item/4001292735395.html?algo_pvid=8b6ef634-7533-4a22-bd7f-f9b9a028bde0&algo_expid=8b6ef634-7533-4a22-bd7f-f9b9a028bde0-5&btsid=0b8b15ea16190717046877920efe8c&ws_ab_test=searchweb0_0,searchweb201602_,searchweb201603_",aliexpress
"syiwidii женское платье с v-образным вырезом, элегантное платье с поясом и высокой талией, длинное трикотажное плиссированное платье трапециеви...","2 255,36 руб.","//aliexpress.ru/item/4001322275174.html?algo_pvid=8b6ef634-7533-4a22-bd7f-f9b9a028bde0&algo_expid=8b6ef634-7533-4a22-bd7f-f9b9a028bde0-6&btsid=0b8b15ea16190717046877920efe8c&ws_ab_test=searchweb0_0,searchweb201602_,searchweb201603_",aliexpress
Syiwidii миди платья для женщин офисные женские элегантные женские платья на пуговицах с длинным рукавом зима 2021 Новые Формальные платья для же...,"2 367,46 руб.","//aliexpress.ru/item/1005001798449565.html?algo_pvid=8b6ef634-7533-4a22-bd7f-f9b9a028bde0&algo_expid=8b6ef634-7533-4a22-bd7f-f9b9a028bde0-7&btsid=0b8b15ea16190717046877920efe8c&ws_ab_test=searchweb0_0,searchweb201602_,searchweb201603_",aliexpress
"Красные вечерние платья с высоким и низким вырезом, пышное вечернее платье с V-образным вырезом для особых случаев в Дубае, саудовском, арабс...","7 246,04 руб.","//aliexpress.ru/item/4001228630565.html?algo_pvid=67ee8ba5-89f3-42c4-8804-f40632833d42&algo_expid=67ee8ba5-89f3-42c4-8804-f40632833d42-0&btsid=0b8b15ea16190717095587944efe8c&ws_ab_test=searchweb0_0,searchweb201602_,searchweb201603_",aliexpress
"Женское облегающее платье с драконом, летние сарафаны без рукавов с разрезом на бедрах, лето 2021","305,50 - 336,29 руб.","//aliexpress.ru/item/1005002460423797.html?algo_pvid=67ee8ba5-89f3-42c4-8804-f40632833d42&algo_expid=67ee8ba5-89f3-42c4-8804-f40632833d42-1&btsid=0b8b15ea16190717095587944efe8c&ws_ab_test=searchweb0_0,searchweb201602_,searchweb201603_",aliexpress
Спагетти ремень бретели мини платье женское сексуальное облегающее Клубное платье вечерние платья 2021 новые летние Однотонная одежда летне...,"246,30 руб.","//aliexpress.ru/item/4001065617971.html?algo_pvid=67ee8ba5-89f3-42c4-8804-f40632833d42&algo_expid=67ee8ba5-89f3-42c4-8804-f40632833d42-2&btsid=0b8b15ea16190717095587944efe8c&ws_ab_test=searchweb0_0,searchweb201602_,searchweb201603_",aliexpress
Детская одежда 2020 Новое модное летнее платье Детская Хлопковая Милая футболка с летящими рукавами и маленьким полосатым бантом платье для ...,"393,92 руб.","//aliexpress.ru/item/4001158487377.html?algo_pvid=67ee8ba5-89f3-42c4-8804-f40632833d42&algo_expid=67ee8ba5-89f3-42c4-8804-f40632833d42-3&btsid=0b8b15ea16190717095587944efe8c&ws_ab_test=searchweb0_0,searchweb201602_,searchweb201603_",aliexpress
"Женское Повседневное платье из хлопка и льна, Элегантное Длинное ТРАПЕЦИЕВИДНОЕ ПЛАТЬЕ в винтажном стиле с цветочным принтом, T001, лето 2021","1 533,83 руб.","//aliexpress.ru/item/1005002408491236.html?s=p&ad_pvid=202104212308291994414665585920000906795_13&algo_pvid=67ee8ba5-89f3-42c4-8804-f40632833d42&algo_expid=67ee8ba5-89f3-42c4-8804-f40632833d42-4&btsid=0b8b15ea16190717095587944efe8c&ws_ab_test=searchweb0_0,searchweb201602_,searchweb201603_",aliexpress
Одежда для беременных женские ночные рубашки для кормящих матерей одежда для грудного вскармливания платье с коротким рукавом пижамы для б...,"404,97 - 761,79 руб.","//aliexpress.ru/item/1005001884173200.html?algo_pvid=67ee8ba5-89f3-42c4-8804-f40632833d42&algo_expid=67ee8ba5-89f3-42c4-8804-f40632833d42-5&btsid=0b8b15ea16190717095587944efe8c&ws_ab_test=searchweb0_0,searchweb201602_,searchweb201603_",aliexpress
Платье детское летнее плявечерние без рукавов с изображением фруктов,"183,14 - 198,93 руб.","//aliexpress.ru/item/32899189952.html?algo_pvid=67ee8ba5-89f3-42c4-8804-f40632833d42&algo_expid=67ee8ba5-89f3-42c4-8804-f40632833d42-6&btsid=0b8b15ea16190717095587944efe8c&ws_ab_test=searchweb0_0,searchweb201602_,searchweb201603_",aliexpress
"Новинка лета 2021, хлопковое платье-слинг для маленьких девочек, детская Повседневная стильная одежда для маленьких девочек, детские платья п...","309,45 - 358,39 руб.","//aliexpress.ru/item/33013897620.html?algo_pvid=67ee8ba5-89f3-42c4-8804-f40632833d42&algo_expid=67ee8ba5-89f3-42c4-8804-f40632833d42-7&btsid=0b8b15ea16190717095587944efe8c&ws_ab_test=searchweb0_0,searchweb201602_,searchweb201603_",aliexpress
"Женская обувь с милым рисунком, летнее платье с цветочным рисунком для маленьких девочек одежда без рукавов, на пуговицах, с цветочным узоро...","172,09 - 188,67 руб.","//aliexpress.ru/item/32970140272.html?algo_pvid=e1f4f21a-d443-4736-af43-90bbde0c345c&algo_expid=e1f4f21a-d443-4736-af43-90bbde0c345c-0&btsid=0b8b15ea16190717117747947efe8c&ws_ab_test=searchweb0_0,searchweb201602_,searchweb201603_",aliexpress
"2 шт. Детское платье для маленьких девочек летнее платье для девочек и рукавами-крылышками для девочек, детские платья для новорожденных Хло...","163,41 - 170,51 руб.","//aliexpress.ru/item/1005002395414578.html?algo_pvid=e1f4f21a-d443-4736-af43-90bbde0c345c&algo_expid=e1f4f21a-d443-4736-af43-90bbde0c345c-1&btsid=0b8b15ea16190717117747947efe8c&ws_ab_test=searchweb0_0,searchweb201602_,searchweb201603_",aliexpress
"Повседневное платье макси без рукавов и с бантом для новорожденных девочек + комплект с повязкой на голову, одежда с бантом и оборками, красн...","179,99 - 342,61 руб.","//aliexpress.ru/item/1005001929411209.html?algo_pvid=e1f4f21a-d443-4736-af43-90bbde0c345c&algo_expid=e1f4f21a-d443-4736-af43-90bbde0c345c-2&btsid=0b8b15ea16190717117747947efe8c&ws_ab_test=searchweb0_0,searchweb201602_,searchweb201603_",aliexpress
2020 популярное однотонное платье с завязкой на талии для беременных женщин мягкое и удобное хлопковое платье для беременных,"978,87 руб.","//aliexpress.ru/item/10000013427207.html?algo_pvid=e1f4f21a-d443-4736-af43-90bbde0c345c&algo_expid=e1f4f21a-d443-4736-af43-90bbde0c345c-3&btsid=0b8b15ea16190717117747947efe8c&ws_ab_test=searchweb0_0,searchweb201602_,searchweb201603_",aliexpress
"2021 летнее платье в стиле бохо, Цветочный принт Длинные Вечерние Платье женское элегантное платье с лямкой на шее без рукавные Макси платье н...","1 045,97 руб.","//aliexpress.ru/item/1005002492304442.html?s=p&ad_pvid=202104212308313294719914601170018006433_25&algo_pvid=e1f4f21a-d443-4736-af43-90bbde0c345c&algo_expid=e1f4f21a-d443-4736-af43-90bbde0c345c-4&btsid=0b8b15ea16190717117747947efe8c&ws_ab_test=searchweb0_0,searchweb201602_,searchweb201603_",aliexpress
"Женское летнее повседневное облегающее мини-платье с открытой спиной, модель 2021 года","773,63 руб.","//aliexpress.ru/item/1005002475569424.html?algo_pvid=e1f4f21a-d443-4736-af43-90bbde0c345c&algo_expid=e1f4f21a-d443-4736-af43-90bbde0c345c-5&btsid=0b8b15ea16190717117747947efe8c&ws_ab_test=searchweb0_0,searchweb201602_,searchweb201603_",aliexpress
"#5 детская одежда, милая детская одежда для девочек, подтяжки, платье принцессы с цветочным рисунком, шапка, одежда, наряды, платье принцессы ...","185,51 - 333,13 руб.","//aliexpress.ru/item/1005002261386175.html?algo_pvid=e1f4f21a-d443-4736-af43-90bbde0c345c&algo_expid=e1f4f21a-d443-4736-af43-90bbde0c345c-6&btsid=0b8b15ea16190717117747947efe8c&ws_ab_test=searchweb0_0,searchweb201602_,searchweb201603_",aliexpress
Узнайте мечта Мода размера плюс для женщин рукав «летучая мышь» вышитые плиссированное платье в богемном стиле темно-синий кружево платье ...,"2 093,53 руб.","//aliexpress.ru/item/1005002396671438.html?algo_pvid=e1f4f21a-d443-4736-af43-90bbde0c345c&algo_expid=e1f4f21a-d443-4736-af43-90bbde0c345c-7&btsid=0b8b15ea16190717117747947efe8c&ws_ab_test=searchweb0_0,searchweb201602_,searchweb201603_",aliexpress
Одежда для маленьких девочек; Платье с принтом Минни; Платье с рукавами-пузырьками для малышей; Милые вечерние платья-пачки для маленьких де...,"227,35 руб.","//aliexpress.ru/item/4001207684490.html?algo_pvid=b14490fe-1cbd-4a55-8c9d-fc462c9d3438&algo_expid=b14490fe-1cbd-4a55-8c9d-fc462c9d3438-0&btsid=0b8b15ea16190717139757951efe8c&ws_ab_test=searchweb0_0,searchweb201602_,searchweb201603_",aliexpress
"Женское платье с длинным рукавом в стиле преппи, однотонные милые Нечеткие платья, простые элегантные плиссированные японские студенчески...","1 180,18 руб.","//aliexpress.ru/item/1005001317950461.html?algo_pvid=b14490fe-1cbd-4a55-8c9d-fc462c9d3438&algo_expid=b14490fe-1cbd-4a55-8c9d-fc462c9d3438-1&btsid=0b8b15ea16190717139757951efe8c&ws_ab_test=searchweb0_0,searchweb201602_,searchweb201603_",aliexpress
Беременности и родам Подставки для фотографий платье макси для беременных кружевное платье для беременных; Платье для беременных Для женщи...,"281,82 руб.","//aliexpress.ru/item/4000521733038.html?algo_pvid=b14490fe-1cbd-4a55-8c9d-fc462c9d3438&algo_expid=b14490fe-1cbd-4a55-8c9d-fc462c9d3438-2&btsid=0b8b15ea16190717139757951efe8c&ws_ab_test=searchweb0_0,searchweb201602_,searchweb201603_",aliexpress
Женская обувь в Корейском стиле; Из джинсовой ткани; Детское Повседневное платье; Сезон лето v-образный вырез с коротким рукавом однотонное ...,"1 041,24 руб.","//aliexpress.ru/item/1005002468570993.html?algo_pvid=b14490fe-1cbd-4a55-8c9d-fc462c9d3438&algo_expid=b14490fe-1cbd-4a55-8c9d-fc462c9d3438-3&btsid=0b8b15ea16190717139757951efe8c&ws_ab_test=searchweb0_0,searchweb201602_,searchweb201603_",aliexpress
"Новое поступление, сексуальное женское платье CVYATAYA с расклешенными рукавами, оборками и V-образным вырезом, весенне-осенние однотонные мини...","1 184,12 руб.","//aliexpress.ru/item/1005001933715109.html?s=p&ad_pvid=20210421230834373760648164110018010952_37&algo_pvid=b14490fe-1cbd-4a55-8c9d-fc462c9d3438&algo_expid=b14490fe-1cbd-4a55-8c9d-fc462c9d3438-4&btsid=0b8b15ea16190717139757951efe8c&ws_ab_test=searchweb0_0,searchweb201602_,searchweb201603_",aliexpress
"Винтажное платье для новорожденных девочек, летнее кружевное платье принцессы с оборками, платья для маленьких девочек, праздничные костюм...","251,03 - 277,08 руб.","//aliexpress.ru/item/32971014853.html?algo_pvid=b14490fe-1cbd-4a55-8c9d-fc462c9d3438&algo_expid=b14490fe-1cbd-4a55-8c9d-fc462c9d3438-5&btsid=0b8b15ea16190717139757951efe8c&ws_ab_test=searchweb0_0,searchweb201602_,searchweb201603_",aliexpress
"2 шт Для детей, на лето Одежда для маленьких девочек одежда для маленьких девочек, платья милый узор в горошек; С модным принтом; Хлопковое пл...","449,18 руб.","//aliexpress.ru/item/1005002099738628.html?algo_pvid=b14490fe-1cbd-4a55-8c9d-fc462c9d3438&algo_expid=b14490fe-1cbd-4a55-8c9d-fc462c9d3438-6&btsid=0b8b15ea16190717139757951efe8c&ws_ab_test=searchweb0_0,searchweb201602_,searchweb201603_",aliexpress
"Летнее платье для девочек, платье без рукавов с мультяшными цветами для маленьких девочек, детская одежда для девочек от 0 до 5 лет, детские п...","314,98 - 330,76 руб.","//aliexpress.ru/item/1005001472144574.html?algo_pvid=b14490fe-1cbd-4a55-8c9d-fc462c9d3438&algo_expid=b14490fe-1cbd-4a55-8c9d-fc462c9d3438-7&btsid=0b8b15ea16190717139757951efe8c&ws_ab_test=searchweb0_0,searchweb201602_,searchweb201603_",aliexpress
"Женская Туника Платье для кормящих матерей Грудное вскармливание летнее Полосатое платье для беременных; Материнство, Одежда для беременн...","332,34 - 660,74 руб.","//aliexpress.ru/item/1005002306545014.html?algo_pvid=08d87c90-546e-4490-a8ea-86685e1d59d3&algo_expid=08d87c90-546e-4490-a8ea-86685e1d59d3-0&btsid=0b8b15ea16190717160517955efe8c&ws_ab_test=searchweb0_0,searchweb201602_,searchweb201603_",aliexpress
"2021 летняя детская одежда для девочек платье с короткими рукавами в радужную узоры, в который входит платье покроя «Принцессы» + головной убо...","194,20 - 352,87 руб.","//aliexpress.ru/item/1005002447802485.html?algo_pvid=08d87c90-546e-4490-a8ea-86685e1d59d3&algo_expid=08d87c90-546e-4490-a8ea-86685e1d59d3-1&btsid=0b8b15ea16190717160517955efe8c&ws_ab_test=searchweb0_0,searchweb201602_,searchweb201603_",aliexpress
"От 1 до 6 лет, платья для девочек, Для детей, на лето, без рукавов, на лямках, платье принцессы для девочек из хлопка Одежда для детей с цветочны...","157,09 - 326,03 руб.","//aliexpress.ru/item/1005002485146958.html?algo_pvid=08d87c90-546e-4490-a8ea-86685e1d59d3&algo_expid=08d87c90-546e-4490-a8ea-86685e1d59d3-2&btsid=0b8b15ea16190717160517955efe8c&ws_ab_test=searchweb0_0,searchweb201602_,searchweb201603_",aliexpress
"Комплект из 3 предметов, женская одежда для беременных с рюшами, облегающее платье для мамы, повседневные платья с коротким рукавом, женская ...","1 025,45 руб.","//aliexpress.ru/item/32962199796.html?algo_pvid=08d87c90-546e-4490-a8ea-86685e1d59d3&algo_expid=08d87c90-546e-4490-a8ea-86685e1d59d3-3&btsid=0b8b15ea16190717160517955efe8c&ws_ab_test=searchweb0_0,searchweb201602_,searchweb201603_",aliexpress
Летнее платье 2020 Женское Платье Vestidos Повседневная тай-дай одежда роковой шикарные пляжные спагетти и ремешком на щиколотке в виде буквы «-Д...,"1 146,23 руб.","//aliexpress.ru/item/1005002220604345.html?s=p&ad_pvid=20210421230836986619097874040018008617_49&algo_pvid=08d87c90-546e-4490-a8ea-86685e1d59d3&algo_expid=08d87c90-546e-4490-a8ea-86685e1d59d3-4&btsid=0b8b15ea16190717160517955efe8c&ws_ab_test=searchweb0_0,searchweb201602_,searchweb201603_",aliexpress
"Платье для маленьких девочек с цветочным принтом, соломенная шляпа, наряды, одежда, Детский сарафан, платья принцессы, наряд для маленьких д...","172,09 - 273,93 руб.","//aliexpress.ru/item/1005002460968905.html?algo_pvid=08d87c90-546e-4490-a8ea-86685e1d59d3&algo_expid=08d87c90-546e-4490-a8ea-86685e1d59d3-5&btsid=0b8b15ea16190717160517955efe8c&ws_ab_test=searchweb0_0,searchweb201602_,searchweb201603_",aliexpress
"Женское повседневное летнее детское платье, Хлопковые Платья с цветочным рисунком для младенцев, одежда с оборками для маленьких девочек","228,14 руб.","//aliexpress.ru/item/32875118535.html?algo_pvid=08d87c90-546e-4490-a8ea-86685e1d59d3&algo_expid=08d87c90-546e-4490-a8ea-86685e1d59d3-6&btsid=0b8b15ea16190717160517955efe8c&ws_ab_test=searchweb0_0,searchweb201602_,searchweb201603_",aliexpress
"#5 Детская Одежда с принтом для девочек, подтяжки для маленьких девочек, платье принцессы с цветочным рисунком, шапка, Одежда, Детская Одежда","194,20 - 348,92 руб.","//aliexpress.ru/item/1005002261273686.html?algo_pvid=08d87c90-546e-4490-a8ea-86685e1d59d3&algo_expid=08d87c90-546e-4490-a8ea-86685e1d59d3-7&btsid=0b8b15ea16190717160517955efe8c&ws_ab_test=searchweb0_0,searchweb201602_,searchweb201603_",aliexpress
"Детское платье без рукавов DIIMUU, весеннее платье для девочек 1-3 лет","212,35 руб.","//aliexpress.ru/item/4000026300185.html?algo_pvid=7041e494-9c83-4f20-b876-b91507e62c4a&algo_expid=7041e494-9c83-4f20-b876-b91507e62c4a-0&btsid=0b8b15ea16190717181587973efe8c&ws_ab_test=searchweb0_0,searchweb201602_,searchweb201603_",aliexpress
"Платье для женская летняя обувь с круглым вырезом, женская блузка с буфами на рукавах; Топы с короткими рукавами рубашка на бретелях, платье ...","1 004,14 руб.","//aliexpress.ru/item/1005002444927256.html?algo_pvid=7041e494-9c83-4f20-b876-b91507e62c4a&algo_expid=7041e494-9c83-4f20-b876-b91507e62c4a-1&btsid=0b8b15ea16190717181587973efe8c&ws_ab_test=searchweb0_0,searchweb201602_,searchweb201603_",aliexpress
"Вязаное платье-свитер с высоким воротником, женское осенне-зимнее эластичное кашемировое платье-свитер средней длины, толстое платье-свите...","1 517,26 руб.","//aliexpress.ru/item/1005001789627416.html?algo_pvid=7041e494-9c83-4f20-b876-b91507e62c4a&algo_expid=7041e494-9c83-4f20-b876-b91507e62c4a-2&btsid=0b8b15ea16190717181587973efe8c&ws_ab_test=searchweb0_0,searchweb201602_,searchweb201603_",aliexpress
"Платье принцессы для девочек, костюм с блестками и маленькой русалочкой, модная одежда для девочек, детский наряд для пляжной вечеринки, кос...","1 000,19 руб.","//aliexpress.ru/item/1005001531027260.html?algo_pvid=7041e494-9c83-4f20-b876-b91507e62c4a&algo_expid=7041e494-9c83-4f20-b876-b91507e62c4a-3&btsid=0b8b15ea16190717181587973efe8c&ws_ab_test=searchweb0_0,searchweb201602_,searchweb201603_",aliexpress
"Новый комплект из обуви в африканском стиле золотого воск икань хлопковый материал высокого качества, с принтом Pagne в нигерийском стиле Анк...","2 429,82 руб.","//aliexpress.ru/item/1005001395605237.html?s=p&ad_pvid=20210421230838530649891574430000766869_61&algo_pvid=7041e494-9c83-4f20-b876-b91507e62c4a&algo_expid=7041e494-9c83-4f20-b876-b91507e62c4a-4&btsid=0b8b15ea16190717181587973efe8c&ws_ab_test=searchweb0_0,searchweb201602_,searchweb201603_",aliexpress
"Летнее платье для маленьких девочек с оборками и рукавами-фонариками, модное Радужное Сетчатое простроченное ТРАПЕЦИЕВИДНОЕ мини-платье п...","246,30 руб.","//aliexpress.ru/item/1005002050210217.html?algo_pvid=7041e494-9c83-4f20-b876-b91507e62c4a&algo_expid=7041e494-9c83-4f20-b876-b91507e62c4a-5&btsid=0b8b15ea16190717181587973efe8c&ws_ab_test=searchweb0_0,searchweb201602_,searchweb201603_",aliexpress
"Цветочные платья для грудного вскармливания, Одежда для беременных, Одежда для беременных, платья для беременных с v-образным вырезом, вечер...","867,57 - 1 072,81 руб.","//aliexpress.ru/item/4001249895929.html?algo_pvid=7041e494-9c83-4f20-b876-b91507e62c4a&algo_expid=7041e494-9c83-4f20-b876-b91507e62c4a-6&btsid=0b8b15ea16190717181587973efe8c&ws_ab_test=searchweb0_0,searchweb201602_,searchweb201603_",aliexpress
"Комплект из 2 предметов платья для малышек, детское платье для девочек 2021 платье с короткими рукавами в радужную узоры, в который входит плат...","329,19 - 479,96 руб.","//aliexpress.ru/item/1005002365342385.html?algo_pvid=7041e494-9c83-4f20-b876-b91507e62c4a&algo_expid=7041e494-9c83-4f20-b876-b91507e62c4a-7&btsid=0b8b15ea16190717181587973efe8c&ws_ab_test=searchweb0_0,searchweb201602_,searchweb201603_",aliexpress
Новинка 2020 года; Популярное модное милое платье с Минни Маус; Платье из чистого хлопка с длинными рукавами для маленьких девочек; Мини-плать...,"170,51 руб.","//aliexpress.ru/item/4001139300396.html?algo_pvid=bda2d55a-7162-413f-9978-515914c08c66&algo_expid=bda2d55a-7162-413f-9978-515914c08c66-0&btsid=0b8b15ea16190717202897993efe8c&ws_ab_test=searchweb0_0,searchweb201602_,searchweb201603_",aliexpress
